{
  "sprintId": "FORGE-S12",
  "feature_id": "FEAT-005",
  "title": "Pipeline Reliability and Bug-Fix Workflow Hardening",
  "description": "Eliminate dead ends, enforce phase gates, ensure real timestamps and programmatic cost capture, and verify store writes across Forge workflows.",
  "goal": "Every user-facing command path reaches a valid terminal state; every store write is verified; every record carries real timestamps and cost data.",
  "status": "active",
  "taskIds": [
    "FORGE-S12-T01",
    "FORGE-S12-T02",
    "FORGE-S12-T03",
    "FORGE-S12-T04",
    "FORGE-S12-T05",
    "FORGE-S12-T06"
  ],
  "dependencies": {
    "FORGE-S12-T04": ["FORGE-S12-T03"]
  },
  "executionMode": "sequential",
  "createdAt": "2026-04-20T12:00:00Z",
  "path": "engineering/sprints/FORGE-S12",
  "features": ["FEAT-005"]
}