{
  "sprintId": "FORGE-S09",
  "feature_id": null,
  "title": "Calibration, Guardrails, and Bug Closure",
  "status": "active",
  "taskIds": [
    "FORGE-S09-T01",
    "FORGE-S09-T02",
    "FORGE-S09-T03",
    "FORGE-S09-T04",
    "FORGE-S09-T05",
    "FORGE-S09-T06",
    "FORGE-S09-T07",
    "FORGE-S09-T08",
    "FORGE-S09-T09"
  ],
  "executionMode": "sequential",
  "createdAt": "2026-04-15T00:00:00.000Z",
  "path": "engineering/sprints/FORGE-S09"
}